{
  "version": 2,
  "updated_at": "2026-02-14T10:55:00Z",
  "registry": {
    "name": "Nexus Community",
    "description": "Official community registry for Nexus plugins and extensions",
    "homepage": "https://github.com/imdanibytes/registry",
    "maintainer": "imdanibytes"
  },
  "plugins": [],
  "extensions": []
}
